id,claim,negated_claim,label_original,label_negated
VL003188,Health officials: At least 2 Idaho kids have died from flu.,Health officials: At least 2 Idaho kids have not died from flu.,true,false
VL003190,Herd immunity is probably why California has far fewer COVID-19 deaths than New York.,Herd immunity is not probably why California has far fewer COVID-19 deaths than New York.,false,true
VL003197,"""Gilberto Hinojosa Says if Texas abortion measure passes, """"someone living in El Paso would have to drive 550 miles each way to San Antonio for something as simple as cervical cancer screening.""","""Gilberto Hinojosa Says if Texas abortion measure passes, """"someone living in El Paso would not have to drive 550 miles each way to San Antonio for something as simple as cervical cancer screening."".",false,true
VL003200,A man using bath salts reported that raccoons had set fire inside his home and stolen his cell phone.,A man using bath salts reported that raccoons had not set fire inside his home and stolen his cell phone.,true,false
VL003206,"""Singer """"Mama"""" Cass Elliot experienced an increase in her vocal range after she was hit in the head by a pipe.""","""Singer """"Mama"""" Cass Elliot experienced an increase in her vocal range after she was not hit in the head by a pipe."".",false,true
VL003208,"EXPERIMENTAL DRUG VISTUSERTIB COULD SHRINKS TUMORS IN 50% OF OVARIAN CANCER PATIENTS, STUDY SUGGESTS","EXPERIMENTAL DRUG VISTUSERTIB COULD not SHRINKS TUMORS IN 50% OF OVARIAN CANCER PATIENTS, STUDY SUGGESTS.",false,true
VL003211,"The gun epidemic is the leading cause of death of young African-American men, more than the next nine causes put together.","The gun epidemic is the leading cause of death of young African-American men, more than the next nine does not cause put together.",true,false
VL003213,Drugs that activate brain stem cells may reverse multiple sclerosis,Drugs that activate brain stem cells may not reverse multiple sclerosis.,true,false
VL003214,Study: Cancer drug may endanger heart,Study: Cancer drug may not endanger heart.,false,true
VL003216,"There are various rumors surrounding the events of the bombing at the April 15, 2013 Marathon in Boston, MA.  At least three people have been killed and 140 people have been injured as a result of two bombs that exploded near the finish line.","There are not various rumors surrounding the events of the bombing at the April 15, 2013 Marathon in Boston, MA. At least three people have been killed and 140 people have been injured as a result of two bombs that exploded near the finish line.",false,true
VL003220,The discovery of a vaccine for the autoimmune disease diabetes has been announced.,The discovery of a vaccine for the autoimmune disease diabetes has not been announced.,false,true
VL003221,Acupuncture May Help Restore Lost Sense of Smell,Acupuncture May not Help Restore Lost Sense of Smell.,false,true
VL003222,"""Benzene has """"never been proven to be harmful.""","""Benzene has not """"never been proven to be harmful."".",false,true
VL003224,"“We were slow with the testing, but very quick with the travel ban. And that's been much more critical in saving lives.”","“We were not slow with the testing, but very quick with the travel ban. And that's been much more critical in saving lives.”.",false,true
VL003227,"There is a proven natural cure for cancer called sour honey, but pharmaceutical companies and politicians are trying to keep it under wraps for financial gain.","There is not a proven natural cure for cancer called sour honey, but pharmaceutical companies and politicians are trying to keep it under wraps for financial gain.",false,true
VL003228,"Viral image Says if you donate blood, “they HAVE to test you” for coronavirus.","Viral image Says if you donate blood, “they HAVE not to test you” for coronavirus.",false,true
VL003230,"""Sen. John McCain was referred to as """"Songbird John"""" following his imprisonment during the Vietnam War.""","""Sen. John McCain was not referred to as """"Songbird John"""" following his imprisonment during the Vietnam War."".",false,true
VL003232,Sleeping in on weekends may help reduce diabetes risk,Sleeping in on weekends may not help reduce diabetes risk.,true,false
VL003236,"""After 44 years, we just got it passed ... veteran's choice. ... I said, I have the greatest idea. We're going to do this."""" ""","""After 44 years, we just got it passed ... veteran's choice. ... I said, I have not the greatest idea. We're going to do this."""" "".",false,true
VL003238,“Ultraviolet Radiation is administered into the body as a disinfectant to kill bacteria and viruses and this has been used for a while now.”,“Ultraviolet Radiation is not administered into the body as a disinfectant to kill bacteria and viruses and this has been used for a while now.”.,false,true
VL003239,"The deadly Klebsiella plague from China is coming to the United States, and citizens have been warned to take action.","The deadly Klebsiella plague from China is not coming to the United States, and citizens have been warned to take action.",false,true
VL003241,"""Scientists """"are shocked to discover that weed kills corona virus”""","""Scientists """"are not shocked to discover that weed kills corona virus”"".",false,true
VL003243,"""COVID-19"""" is named so because it is the 19th """"Chinese-Originated Viral Infectious Disease.""","""COVID-19"""" is not named so because it is the 19th """"Chinese-Originated Viral Infectious Disease."".",false,true
VL003244,A report that the assassination of a top Democratic Party official named Seth Rich while he was on his way to testify about Hillary Clinton has led to the FBI capturing a so-called Clinton “Hit Team.”,A report that the assassination of a top Democratic Party official named Seth Rich while he was not on his way to testify about Hillary Clinton has led to the FBI capturing a so-called Clinton “Hit Team.”.,false,true
VL003246,Canada was placed under a nationwide boil-water notice in the spring of 2019.,Canada was not placed under a nationwide boil-water notice in the spring of 2019.,false,true
VL003260,"Teachers have gotten into trouble over using 'The L.A. Math Test,' a piece of online humor, in the classroom.","Teachers have not gotten into trouble over using 'The L.A. Math Test,' a piece of online humor, in the classroom.",true,false
VL003261,"The United States government is paying people $3,000 a week to smoke marijuana through a federal clinical study.","The United States government is not paying people $3,000 a week to smoke marijuana through a federal clinical study.",false,true
VL003262,"Georgia is on track for 1,200 traffic fatalities this year, a reversal of nine years of declines.","Georgia is not on track for 1,200 traffic fatalities this year, a reversal of nine years of declines.",true,false
VL003263,"""When New York Gov. Eliot Spitzer wanted to """"provide driver’s licenses to those who are undocumented. (Hillary Clinton) said don’t do it.""","""When New York Gov. Eliot Spitzer wanted to """"provide driver’s licenses to those who are not undocumented. (Hillary Clinton) said don’t do it."".",true,false
VL003268,Viral image Says Queen Elizabeth said Philippine President Rodrigo Duterte “is the kind of leader who knows the way .... Filipinos are very lucky to have him.”,Viral image Says Queen Elizabeth said Philippine President Rodrigo Duterte “is not the kind of leader who knows the way .... Filipinos are very lucky to have him.”.,false,true
VL003269,"""A COVID-19 protester held a sign that said """"muzzles are for dogs and slaves,"""" alongside an illustration of a masked woman of color.""","""A COVID-19 protester held a sign that said """"muzzles are not for dogs and slaves,"""" alongside an illustration of a masked woman of color."".",true,false
VL003273,"""Claims that former Sen. Tom Daschle said, """"Seniors should be more accepting of the conditions that come with age instead of treating them.""","""Claims that former Sen. Tom Daschle said, """"Seniors should not be more accepting of the conditions that come with age instead of treating them."".",false,true
VL003275,"""The nursery rhyme """"Ring Around the Rosie"""" is a coded reference to the Black Plague.""","""The nursery rhyme """"Ring Around the Rosie"""" is not a coded reference to the Black Plague."".",false,true
VL003276,"The lobster with which a woman was masturbating defecated into her vagina, implanting brine shrimp eggs which hatched inside","The lobster with which a woman was not masturbating defecated into her vagina, implanting brine shrimp eggs which hatched inside.",false,true
VL003280,Diet shown to reduce stroke risk may also reduce risk of depression,Diet shown to reduce stroke risk may not also reduce risk of depression.,false,true
VL003282,"""Several times, Obama """"has apologized for what he deems to be American arrogance, dismissiveness, and derision; for dictating solutions, for acting unilaterally ... .""","""Several times, Obama """"has not apologized for what he deems to be American arrogance, dismissiveness, and derision; for dictating solutions, for acting unilaterally ... ."".",false,true
VL003284,Budweiser has pulled its ads and withdrawn its support for the NFL over the league’s handling of players protesting inequality by kneeling during the National Anthem.,Budweiser has not pulled its ads and withdrawn its support for the NFL over the league’s handling of players protesting inequality by kneeling during the National Anthem.,false,true
VL003285,There are more pain clinics in Broward County than there are McDonald's in Broward County.,There are not more pain clinics in Broward County than there are McDonald's in Broward County.,true,false
VL003294,New Scan May Spot Alzheimerâ€™s,New Scan May not Spot Alzheimerâ€™s.,false,true
VL003298,President Obama has broken his pledge to the American people to be transparent throughout (health care reform negotiations).,President Obama has not broken his pledge to the American people to be transparent throughout (health care reform negotiations).,true,false
VL003301,"""The media is covering up that """"multiple shooters"""" were involved in the mass killing at an Orlando nightclub.""","""The media is not covering up that """"multiple shooters"""" were involved in the mass killing at an Orlando nightclub."".",false,true
VL003306,"""Birth control pioneer Margaret Sanger was """"an active participant in the Ku Klux Klan.""","""Birth control pioneer Margaret Sanger was not """"an active participant in the Ku Klux Klan."".",false,true
VL003307,Chocolate may be good for your heart: study.,Chocolate may not be good for your heart: study.,true,false
VL003311,Kellogg's Corn Flakes were originally created in an effort to discourage American consumers from masturbating.,Kellogg's Corn Flakes were not originally created in an effort to discourage American consumers from masturbating.,false,true
VL003316,"Big spending bill wins Senate OK, has victories all around.","Big spending bill wins Senate OK, has not victories all around.",true,false
VL003327,"The Earth is 6,000 years old, that’s a fact.","The Earth is not 6,000 years old, that’s a fact.",false,true
VL003328,EU: Malaria drugs used for virus could cause side effects.,EU: Malaria drugs used for virus could not cause side effects.,true,false
VL003332,Health insurance costs for Floridians are up 30 percent or more.,Health insurance costs for Floridians are not up 30 percent or more.,false,true
VL003333,Trial for New Lupus Treatment Is Called Promising,Trial for New Lupus Treatment Is not Called Promising.,true,false
VL003336,It’s Comical. It’s Critical. It Might Even Help You Lose Weight.,It’s Comical. It’s Critical. It Might not Even Help You Lose Weight.,true,false
VL003337,Congresswoman Ros-Lehtinen has long record of voting against VA backlog fixes.,Congresswoman Ros-Lehtinen has not long record of voting against VA backlog fixes.,false,true
VL003341,The fact is 90-percent of Down Syndrome children were aborted in this country.,The fact is not 90-percent of Down Syndrome children were aborted in this country.,false,true
VL003342,Capriccio Bubbly Sangria beverages are contaminated with HIV.,Capriccio Bubbly Sangria beverages are not contaminated with HIV.,false,true
VL003348,"Even for sperm, there is a season.","Even for sperm, there is not a season.",true,false
VL003349,"AOL is donating 15¢ for every 12 forwards of a plea from Debbie Shwartz, a single mother of four.","AOL is not donating 15¢ for every 12 forwards of a plea from Debbie Shwartz, a single mother of four.",false,true
VL003352,Experimental Drug Might Help Fight Alzheimer’s After All,Experimental Drug Might not Help Fight Alzheimer’s After All.,true,false
VL003356,This 8-year-old is free of cancer — for now — after a ‘breakthrough’ treatment,This 8-year-old is not free of cancer — for now — after a ‘breakthrough’ treatment.,true,false
VL003361,Dubai is the only country with huge amounts of imported workers that's actually passed legislation to give these immigrant workers a better deal in the Middle East.,Dubai is not the only country with huge amounts of imported workers that's actually passed legislation to give these immigrant workers a better deal in the Middle East.,false,true
VL003365,Obamacare will question your sex life.,Obamacare will not question your sex life.,false,true
VL003366,Blocking enzyme could help in rare blood cancer.,Blocking enzyme could not help in rare blood cancer.,true,false
VL003371,Eggs and popcorn kernels can be cooked by placing them between activated cell phones.,Eggs and popcorn kernels can not be cooked by placing them between activated cell phones.,false,true
VL003372,"""Promote Oregon Leadership PAC (Oregon House Republicans) Says, """"Carl proposed a 'windfall' tax on real estate development when he was a Metro Councilor.""","""Promote Oregon Leadership PAC (Oregon House Republicans) Says, """"Carl proposed a 'windfall' tax on real estate development when he was not a Metro Councilor."".",false,true
VL003375,Non-Fried Fish Might Help Ward Off Alzheimer’s: Study,Non-Fried Fish Might not Help Ward Off Alzheimer’s: Study.,false,true
VL003377,A member of the Okeechobee County Commission in Florida promoted a claim that using a blow dryer could cure people of COVID-19.,A member of the Okeechobee County Commission in Florida promoted a claim that using a blow dryer could not cure people of COVID-19.,true,false
VL003378,El Paso was one of the U.S. most dangerous cities before a border fence was built there.,El Paso was not one of the U.S. most dangerous cities before a border fence was built there.,false,true
VL003379,Amazon is soliciting public donations to fund sick leave during the COVID-19 pandemic.,Amazon is not soliciting public donations to fund sick leave during the COVID-19 pandemic.,true,false
VL003383,“Small trials” to test convalescent plasma therapy for coronavirus patients “seem to have had some degree of success.”,“Small trials” to test convalescent plasma therapy for coronavirus patients “seem to have not had some degree of success.”.,true,false
VL003387,"“(A recent study) said ‘Medicare for All’ will lower health care costs in this country by $450 billion a year and save the lives of 68,000 people who would otherwise have died.”","“(A recent study) said ‘Medicare for All’ will not lower health care costs in this country by $450 billion a year and save the lives of 68,000 people who would otherwise have died.”.",false,true
VL003389,"“Now, as it stands, our health care system has adequate ventilators, ICU beds, medical professionals.”","“Now, as it stands, our health care system has not adequate ventilators, ICU beds, medical professionals.”.",false,true
VL003390,Oscars producers say the show is in ‘good shape’ for Sunday.,Oscars producers say the show is not in ‘good shape’ for Sunday.,true,false
VL003391,Madmen are injecting HIV-infected blood into unsuspecting moviegoers and random young people dancing in bars or at raves.,Madmen are not injecting HIV-infected blood into unsuspecting moviegoers and random young people dancing in bars or at raves.,false,true
VL003392,Claims that Senator Mitch McConnell had polio as a child and free government healthcare saved his life began making the rounds as McConnell led Senate Republicans’ efforts to repeal and replace Obamacare in June 2017.,Claims that Senator Mitch McConnell had not polio as a child and free government healthcare saved his life began making the rounds as McConnell led Senate Republicans’ efforts to repeal and replace Obamacare in June 2017.,false,true
VL003396,Laser Treatment May Work for Cataracts,Laser Treatment May not Work for Cataracts.,false,true
VL003399,Colonoscopy Prep in a Pill May Be Easier to Swallow,Colonoscopy Prep in a Pill May not Be Easier to Swallow.,false,true
VL003401,"""The United States Navy announced that it was christening a ship the """"USS Tig Ol Bitties"""" after an online vote.""","""The United States Navy announced that it was not christening a ship the """"USS Tig Ol Bitties"""" after an online vote."".",false,true
VL003403,"An article from the pen of disaster rescuer Doug Copp.  He lists some of his observations from being on the scene after earthquakes and introduces what he calls “The Triangle of Life,” which he says can save lives during an earthquake.  He rejects the advice of traditional disaster experts and gives suggestions about what to do and where to be during an earthquake.","An article from the pen of disaster rescuer Doug Copp. He lists some of his observations from being on the scene after earthquakes and introduces what he calls “The Triangle of Life,” which he says can not save lives during an earthquake. He rejects the advice of traditional disaster experts and gives suggestions about what to do and where to be during an earthquake.",false,true
VL003404,"AIDS Vaccine Is of Modest Help, Fuller Research Says","AIDS Vaccine Is not of Modest Help, Fuller Research Says.",true,false
VL003405,"""McCain """"has opposed stem cell research.""","""McCain """"has not opposed stem cell research."".",false,true
VL003406,Everyone in this country has access to health care.,Everyone in this country has not access to health care.,false,true
VL003407,"""In 2019, Will Smith was """"rushed to hospital"""" and """"diagnosed with a life-threatening disease.""","""In 2019, Will not Smith was """"rushed to hospital"""" and """"diagnosed with a life-threatening disease."".",false,true
VL003412,Lung scans may lead to overdiagnosis: study,Lung scans may not lead to overdiagnosis: study.,true,false
VL003413,CDC officials issued a formal apology after it was discovered that the 2014 flu vaccine proved ineffective against a common strain of the flu virus.,CDC officials issued a formal apology after it was not discovered that the 2014 flu vaccine proved ineffective against a common strain of the flu virus.,false,true
VL003427,"Former Arizona senator John McCain confessed to being a war criminal and to committing treason during the Vietnam War, but he was later pardoned by U.S. President Richard Nixon to spare him from death by firing squad.","Former Arizona senator John McCain confessed to being a war criminal and to committing treason during the Vietnam War, but he was not later pardoned by U.S. President Richard Nixon to spare him from death by firing squad.",false,true
VL003429,"Before World War II, very few people actually had health insurance.","Before World War II, very few people actually had not health insurance.",true,false
VL003436,"As of June 23, the COVID-19 death rate is “way down.”","As of June 23, the COVID-19 death rate is not “way down.”.",true,false
VL003437,Young women are inserting vodka-soaked tampons as a furtive way of getting drunk.,Young women are not inserting vodka-soaked tampons as a furtive way of getting drunk.,false,true
VL003438,Handles of shopping carts are laden with germs.,Handles of shopping carts are not laden with germs.,true,false
VL003441,Many types of fish and shellfish from waters across the state are labeled unsafe to eat.,Many types of fish and shellfish from waters across the state are not labeled unsafe to eat.,true,false
VL003442,"In February 2020 the Vatican said that Pope Francis and two aides had tested positive for COVID-19, a disease caused by a new coronavirus.","In February 2020 the Vatican said that Pope Francis and two aides had not tested positive for COVID-19, a disease caused by a new coronavirus.",false,true
VL003444,Exclusive: Nurses at Mexico hospital hit by coronavirus say they were told to avoid masks.,Exclusive: Nurses at Mexico hospital hit by coronavirus say they were not told to avoid masks.,true,false
VL003448,TV celebrity and food writer Anthony Bourdain was planning to run an exposé of an pedophile ring at the time of his death.,TV celebrity and food writer Anthony Bourdain was not planning to run an exposé of an pedophile ring at the time of his death.,false,true
VL003453,"Police in Portland, Oregon determined that anti-fascist activists mixed quick-dry concrete and caustic chemicals into milkshakes that were both thrown and consumed.","Police in Portland, Oregon determined that anti-fascist activists mixed quick-dry concrete and caustic chemicals into milkshakes that were not both thrown and consumed.",false,true
VL003459,Majority Forward Says Sen. Thom Tillis “doesn’t think restaurant workers should have to wash their hands.”,Majority Forward Says Sen. Thom Tillis “doesn’t think restaurant workers should not have to wash their hands.”.,false,true
VL003460,"""Just last year, alone, 710 police officers"""" were assaulted in New York state.""","""Just last year, alone, 710 police officers"""" were not assaulted in New York state."".",true,false
VL003461,"""Hillary Clinton and/or members of her 2008 presidential campaign started the """"birther"""" movement questioning whether Barack Obama was born in the U.S.""","""Hillary Clinton and/or members of her 2008 presidential campaign started the """"birther"""" movement questioning whether Barack Obama was not born in the U.S."".",false,true
VL003470,"Churches are required by the local government to record and register lists of attendees for tracking purposes in Kansas City, Missouri.","Churches are not required by the local government to record and register lists of attendees for tracking purposes in Kansas City, Missouri.",false,true
VL003472,Medal of Honor recipient Kyle Carpenter was stripped of his award for failing to complete a minor driving course while on active duty.,Medal of Honor recipient Kyle Carpenter was not stripped of his award for failing to complete a minor driving course while on active duty.,false,true
VL003475,Stephen Nodine Says he can be on the ballot for Congress while serving time in jail.,Stephen Nodine Says he can not be on the ballot for Congress while serving time in jail.,true,false
VL003476,Here’s how a five-day diet that mimics fasting may ‘reboot’ the body and reduce cancer risk,Here’s how a five-day diet that mimics fasting may not ‘reboot’ the body and reduce cancer risk.,false,true
VL003480,Colonoscopy may miss more than 7 percent of cancers,Colonoscopy may not miss more than 7 percent of cancers.,true,false
VL003481,"""Of the roughly 15 percent of Americans who don’t have health insurance, """"half of them made more than $50,000 a year.""","""Of the roughly 15 percent of Americans who don’t have not health insurance, """"half of them made more than $50,000 a year."".",false,true
VL003483,New York City is set to ban hot dogs and processed meats in an effort to combat climate change.,New York City is not set to ban hot dogs and processed meats in an effort to combat climate change.,false,true
VL003485,There were 32 deaths from suicide in Ireland in August.,There were not 32 deaths from suicide in Ireland in August.,false,true
VL003503,A girl on an amusement park ride was scalped when her hair got caught in the attraction's machinery.,A girl on an amusement park ride was not scalped when her hair got caught in the attraction's machinery.,true,false
VL003505,"Congo, weary from Ebola, must also battle the coronavirus.","Congo, weary from Ebola, must not also battle the coronavirus.",true,false
VL003506,"""Tim Kaine Says Hillary Clinton and millennials have the same positions on climate change, abortion rights, immigration reform, gay rights and college affordability. """"Donald Trump doesn't.""","""Tim Kaine Says Hillary Clinton and millennials have not the same positions on climate change, abortion rights, immigration reform, gay rights and college affordability. """"Donald Trump doesn't."".",true,false
VL003516,Meth in Louisiana is contaminated with the Zika virus.,Meth in Louisiana is not contaminated with the Zika virus.,false,true
VL003520,“If you have the Flu… get these two items… Sambucol (and) Oscillococcinum… in 48 hours you will feel better. In 72 hours you will be almost symptom-free.”,“If you have not the Flu… get these two items… Sambucol (and) Oscillococcinum… in 48 hours you will feel better. In 72 hours you will be almost symptom-free.”.,false,true
VL003521,Pouring Coca-Cola onto a piece of raw pork will cause worms to come crawling out of the meat.,Pouring Coca-Cola onto a piece of raw pork will not cause worms to come crawling out of the meat.,false,true
VL003523,Author Malcolm Gladwell said in a January 2020 speech that a statue of former Penn State football coach Joe Paterno should be restored.,Author Malcolm Gladwell said in a January 2020 speech that a statue of former Penn State football coach Joe Paterno should not be restored.,true,false
