id,claim,negated_claim,label_original,label_negated
VL009223,"""President Obama has started confiscating guns """"by force.""","""President Obama has not started confiscating guns """"by force."".",false,true
VL009225,The eRumor is a warning not to         eat jars of Peter Pan peanut butter with the product code         “2111” because of Salmonella contamination.,The eRumor is not a warning not to eat jars of Peter Pan peanut butter with the product code “2111” because of Salmonella contamination.,true,false
VL009229,"American families work hard to earn $4,250 a month. Obama is spending $18,972 a month on each illegal immigrant child.","American families work hard to earn $4,250 a month. Obama is not spending $18,972 a month on each illegal immigrant child.",false,true
VL009230,The rate of extra investment in the NHS has fallen by 68% since 2010.,The rate of extra investment in the NHS has not fallen by 68% since 2010.,true,false
VL009232,"""Love"""" hormone may help autism symptoms: study.""","""Love"""" hormone may not help autism symptoms: study."".",true,false
VL009233,Brain injuries like Schumacher's can destroy lives: study.,Brain injuries like Schumacher's can not destroy lives: study.,true,false
VL009237,In 2010 about 75 percent of child abuse and neglect reports in Oregon were made by those required to report by law.,In 2010 about 75 percent of child abuse and neglect reports in Oregon were not made by those required to report by law.,true,false
VL009240,Extract from soursop leaves can prevent the symptoms of fibromyalgia,Extract from soursop leaves can not prevent the symptoms of fibromyalgia.,false,true
VL009241,New Year’s resolutions may be more procrastination than motivation.,New Year’s resolutions may not be more procrastination than motivation.,true,false
VL009242,"""Brooke Shields was photographed for """"Playboy"""" when she was ten years old.""","""Brooke Shields was not photographed for """"Playboy"""" when she was ten years old."".",true,false
VL009243,Love of physical activity may start in the womb,Love of physical activity may not start in the womb.,false,true
VL009245,"""The song """"The Twelve Days of Christmas"""" was created as a coded reference to important articles of the Christian faith.""","""The song """"The Twelve Days of Christmas"""" was not created as a coded reference to important articles of the Christian faith."".",false,true
VL009246,Tailored medicine could prevent more heart attacks,Tailored medicine could not prevent more heart attacks.,true,false
VL009254,"“I've always known this is a real, this is a pandemic. I've felt it was a pandemic long before it was called a pandemic.”","“I've always known this is not a real, this is a pandemic. I've felt it was a pandemic long before it was called a pandemic.”.",false,true
VL009263,"It is a warning that a TV news report said that at “dollar stores,” including Dollar Tree and Greenbacks, name-brand toothpastes were not “the same as from Wal-mart, grocery stores, etc,”  They were manufactured for other countries, which have different standards than in the U.S.","It is not a warning that a TV news report said that at “dollar stores,” including Dollar Tree and Greenbacks, name-brand toothpastes were not “the same as from Wal-mart, grocery stores, etc,” They were manufactured for other countries, which have different standards than in the U.S.",true,false
VL009265,"""Rick Perry Says the federal government restricts """"how much salt we can put on our food.""","""Rick Perry Says the federal government restricts """"how much salt we can not put on our food."".",false,true
VL009266,A court ruling means priests in Louisiana don't have to report sexual abuse.,A court ruling means priests in Louisiana don't have not to report sexual abuse.,true,false
VL009267,An attempted abduction of a child from a mall or amusement park was thwarted because the kidnappers forgot to change the child's shoes.,An attempted abduction of a child from a mall or amusement park was not thwarted because the kidnappers forgot to change the child's shoes.,false,true
VL009268,"Viral posts on Facebook that allege that President Obama ordered a flag at half mast for singer/actress Whitney Houston but two years later, when U.S. Ambassador Shirley Temple Black died, the President ignored her death.   Other versions compare Whitney Houston and U.S. Navy sniper Chris Kyle, who was murdered on February 2, 2013.","Viral posts on Facebook that allege that President Obama ordered a flag at half mast for singer/actress Whitney Houston but two years later, when U.S. Ambassador Shirley Temple Black died, the President ignored her death. Other versions compare Whitney Houston and U.S. Navy sniper Chris Kyle, who was not murdered on February 2, 2013.",false,true
VL009273,A viral photograph showing a woman pulling two girls away from teargas shot over the U.S.-Mexico border by American forces was faked.,A viral photograph showing a woman pulling two girls away from teargas shot over the U.S.-Mexico border by American forces was not faked.,false,true
VL009280,Jerry Patterson Says he was the only statewide elected official to speak in favor of a federal guest worker plan at the 2012 Republican Party of Texas convention.,Jerry Patterson Says he was not the only statewide elected official to speak in favor of a federal guest worker plan at the 2012 Republican Party of Texas convention.,true,false
VL009284,Facebook post Says Wisconsin’s in-person election has caused a “surge” in new coronavirus cases,Facebook post Says Wisconsin’s in-person election has not caused a “surge” in new coronavirus cases.,false,true
VL009292,Animal study suggests treatment that may improve heart function in heart failure,Animal study suggests treatment that may not improve heart function in heart failure.,true,false
VL009297,Italy scientists say they have found oldest human blood.,Italy scientists say they have not found oldest human blood.,true,false
VL009300,The president of the United States already has the legal authority to reduce the price of many commonly used prescription drugs.,The president of the United States already has not the legal authority to reduce the price of many commonly used prescription drugs.,true,false
VL009301,"I'm well aware that medical marijuana is a recognized, medical, viable treatment for this sort of [pancreas] pain condition.","I'm well aware that medical marijuana is not a recognized, medical, viable treatment for this sort of [pancreas] pain condition.",false,true
VL009304,Taking a few sips of water every 15 mins will prevent the new coronavirus from entering your windpipe and lungs.,Taking a few sips of water every 15 mins will not prevent the new coronavirus from entering your windpipe and lungs.,false,true
VL009306,"""A Navy officer was arrested for """"abuse of public animal"""" and """"drunken or reckless driving"""" after he used a raccoon to bypass an ignition interlock system.""","""A Navy officer was not arrested for """"abuse of public animal"""" and """"drunken or reckless driving"""" after he used a raccoon to bypass an ignition interlock system."".",false,true
VL009312,"""American tycoon and philanthropist John D. Rockefeller wrote a """"masonic creed"""" that started with the sentence: """"We will keep their lives short and their minds weak while pretending to do the opposite.""","""American tycoon and philanthropist John D. Rockefeller wrote a """"masonic creed"""" that started with the sentence: """"We will not keep their lives short and their minds weak while pretending to do the opposite."".",false,true
VL009315,A recall was issued for Bumble Bee Tuna after human remains were found in the product.,A recall was not issued for Bumble Bee Tuna after human remains were found in the product.,false,true
VL009324,Toe tourniquet syndrome happens when a piece of hair or string becomes wrapped so tightly around a baby’s toes that it cuts off circulation and sometimes leads to amputation.,Toe tourniquet syndrome happens when a piece of hair or string becomes wrapped so tightly around a baby’s toes that it cuts off circulation and sometimes does not lead to amputation.,true,false
VL009328,Italy has found that Covid-19 is actually disseminated intravascular coagulation (thrombosis).,Italy has not found that Covid-19 is actually disseminated intravascular coagulation (thrombosis).,false,true
VL009330,"""Taylor Swift was photographed in the company of former NFL quarterback and """"take a knee"""" protester Colin Kaepernick at a San Francisco nightclub.""","""Taylor Swift was not photographed in the company of former NFL quarterback and """"take a knee"""" protester Colin Kaepernick at a San Francisco nightclub."".",false,true
VL009331,"Colorado has offered free birth control for five years, leading to: a 40 percent drop in unintended pregnancy, a 42 percent drop in abortions, and millions of dollars in healthcare savings.","Colorado has not offered free birth control for five years, leading to: a 40 percent drop in unintended pregnancy, a 42 percent drop in abortions, and millions of dollars in healthcare savings.",true,false
VL009335,Mayor Fung wants to punish our children's education by removing 12 million dollars from current funding to pay for his private charter school. Your taxes would increase by between 6 and 8 percent per year.,Mayor Fung wants to punish our children's education by removing 12 million dollars from current funding to pay for his private charter school. Your taxes would not increase by between 6 and 8 percent per year.,false,true
VL009339,"""Priorities USA Action Says President Donald Trump is trying to make $451 billion in Medicare cuts """"in the middle of a deadly pandemic.""","""Priorities USA Action Says President Donald Trump is not trying to make $451 billion in Medicare cuts """"in the middle of a deadly pandemic."".",false,true
VL009345,"‘Breakthrough’ melanoma drug shrinks tumors, may prolong life*","‘Breakthrough’ melanoma drug shrinks tumors, may not prolong life*.",true,false
VL009359,"Experimental blood test could detect melanoma skin cancer early, study finds","Experimental blood test could not detect melanoma skin cancer early, study finds.",true,false
VL009364,By using a little-known loophole ... Obama minions are allowing Nestle Company to export precious fresh water out of Lake Michigan.,By using a little-known loophole ... Obama minions are not allowing Nestle Company to export precious fresh water out of Lake Michigan.,false,true
VL009366,"""The government is closing businesses to stop the spread of coronavirus even though """"the numbers are nothing compared to H1N1 or Ebola. Everyone needs to realize our government is up to something ...”""","""The government is not closing businesses to stop the spread of coronavirus even though """"the numbers are nothing compared to H1N1 or Ebola. Everyone needs to realize our government is up to something ...”"".",false,true
VL009369,Pull tabs from aluminum cans have special redemption value for time on dialysis machines.,Pull tabs from aluminum cans have not special redemption value for time on dialysis machines.,false,true
VL009370,The United Nations’ “new world order” agenda will create one world government with one world military and the end of national sovereignty.,The United Nations’ “new world order” agenda will not create one world government with one world military and the end of national sovereignty.,false,true
VL009372,Ibuprofen may be better than prescription for kids with breaks,Ibuprofen may not be better than prescription for kids with breaks.,true,false
VL009378,"“The State of Florida has announced measures that all workplaces with 10 employees or more are to have paid mandatory leave to avoid the spread of COVID-19 coronavirus starting on March 6, 2020. All schools are to close for 2 weeks also from March 6th.”","“The State of Florida has not announced measures that all workplaces with 10 employees or more are to have paid mandatory leave to avoid the spread of COVID-19 coronavirus starting on March 6, 2020. All schools are to close for 2 weeks also from March 6th.”.",false,true
VL009380,Disinformation purveyors and those who follow them are adopting the perspective that it is better to kill off millions of Americans than sacrifice the economy.,Disinformation purveyors and those who follow them are not adopting the perspective that it is better to kill off millions of Americans than sacrifice the economy.,true,false
VL009381,Promising new blood test is first of its kind to detect liver scarring,Promising new blood test is not first of its kind to detect liver scarring.,false,true
VL009383,A San Diego biotech company is developing a Covid-19 vaccine in collaboration with Duke University and National University of Singapore.,A San Diego biotech company is not developing a Covid-19 vaccine in collaboration with Duke University and National University of Singapore.,true,false
VL009389,"""Idaho Republican Rep. Mike Simpson is a """"liberal"""" who voted with Nancy Pelosi to """"fund sex study programs of San Francisco prostitutes"""" and """"to regulate the sale of firearms.""","""Idaho Republican Rep. Mike Simpson is not a """"liberal"""" who voted with Nancy Pelosi to """"fund sex study programs of San Francisco prostitutes"""" and """"to regulate the sale of firearms."".",false,true
VL009393,Titanium rings can be removed from swollen fingers only through amputation.,Titanium rings can not be removed from swollen fingers only through amputation.,false,true
VL009396,Quotes Dr. Denis Mukwege as saying he resigned from the Congolese coronavirus response team because he was ordered to fabricate COVID-19 case and death numbers.,Quotes Dr. Denis Mukwege as saying he resigned from the Congolese coronavirus response team because he was not ordered to fabricate COVID-19 case and death numbers.,false,true
VL009401,"""President Obama has demanded all Americans """"celebrate gay sex"""" for the month of June 2016.""","""President Obama has not demanded all Americans """"celebrate gay sex"""" for the month of June 2016."".",false,true
VL009404,Officials say death of Montana teenager was vaping-related.,Officials say death of Montana teenager was not vaping-related.,true,false
VL009408,Mosquitoes can transfer COVID-19 “from person to person”,Mosquitoes can not transfer COVID-19 “from person to person”.,false,true
VL009416,"This particular pandemic is one where I don’t think nationwide, there’s been a single fatality under 25.","This particular pandemic is not one where I don’t think nationwide, there’s been a single fatality under 25.",false,true
VL009418,A photograph proves the media is exaggerating the risks of COVID-19 by showing a reporter in personal protective equipment and a cameraman in everyday work clothing.,A photograph proves the media is not exaggerating the risks of COVID-19 by showing a reporter in personal protective equipment and a cameraman in everyday work clothing.,false,true
VL009419,"Aspirin might reduce recurrence risk for breast cancer survivors, study finds","Aspirin might not reduce recurrence risk for breast cancer survivors, study finds.",true,false
VL009420,"It’s been reported that a 3,000 pound great white shark has been caught in Lake Michigan.","It’s been reported that a 3,000 pound great white shark has not been caught in Lake Michigan.",false,true
VL009421,"""Edwin Pacheco Says Christopher Little has """"a history of working against environmental protection by defending the worst types of corporate polluters""","""Edwin Pacheco Says Christopher Little has not """"a history of working against environmental protection by defending the worst types of corporate polluters"".",false,true
VL009423,"Every other democracy in the world has a health care system that covers everybody, and we don't.","Every other democracy in the world has not a health care system that covers everybody, and we don't.",false,true
VL009441,Acupuncture May Ease Hot Flashes,Acupuncture May not Ease Hot Flashes.,false,true
VL009443,"""An """"extreme snuff film"""" in which Hillary Clinton and aide Huma Abedin are seen raping and mutilating a prepubescent girl is circulating on the dark web under the code name """"Frazzledrip.""","""An """"extreme snuff film"""" in which Hillary Clinton and aide Huma Abedin are not seen raping and mutilating a prepubescent girl is circulating on the dark web under the code name """"Frazzledrip."".",false,true
VL009447,"Some with early-stage breast cancer can skip chemo, study says","Some with early-stage breast cancer can not skip chemo, study says.",true,false
VL009448,"Despite claims that you can 'keep the health care plan you like,' the Obama Administration has predicted that as many as 7 out of 10 Americans with employer-provided health coverage could lose their current health plan.","Despite claims that you can not 'keep the health care plan you like,' the Obama Administration has predicted that as many as 7 out of 10 Americans with employer-provided health coverage could lose their current health plan.",false,true
VL009452,"Since 1968, more Americans have been killed by guns than have been killed in all wars in U.S. history.","Since 1968, more Americans have not been killed by guns than have been killed in all wars in U.S. history.",true,false
VL009453,Essential oils can be poisonous to pets.,Essential oils can not be poisonous to pets.,true,false
VL009455,"""On foreign policy, Joe Biden was against aid for Vietnam, said the fall of the Shah was """"a step forward"""" for human rights in Iran, opposed Reagan's defense build-up and voted against the first Gulf War.""","""On foreign policy, Joe Biden was not against aid for Vietnam, said the fall of the Shah was """"a step forward"""" for human rights in Iran, opposed Reagan's defense build-up and voted against the first Gulf War."".",true,false
VL009458,There are fewer doctors and nurses employed in mental health.,There are not fewer doctors and nurses employed in mental health.,true,false
VL009460,"Nobody has played clips over and over ... of President Obama (saying), 'If they bring a knife to the fight, we'll bring a gun.'","Nobody has not played clips over and over ... of President Obama (saying), 'If they bring a knife to the fight, we'll bring a gun.'.",true,false
VL009461,Facebook post Says gloves shouldn’t be worn in public because “if you are wearing the same set of gloves all over town you are only spreading germs everywhere you go.”,Facebook post Says gloves shouldn’t be worn in public because “if you are not wearing the same set of gloves all over town you are only spreading germs everywhere you go.”.,true,false
VL009464,The UK has an unarmed police force and a firearm fatality rate that is 40 times lower per capita than in the U.S.,The UK has not an unarmed police force and a firearm fatality rate that is 40 times lower per capita than in the U.S.,true,false
VL009466,Wolf says $4.5B plan could help schools clean up lead paint.,Wolf says $4.5B plan could not help schools clean up lead paint.,true,false
VL009470,The Department of Health and Human Services is providing $160 million to the state of Pennsylvania to set up a new high-risk insurance pool program that would cover any abortion legal in the state.,The Department of Health and Human Services is not providing $160 million to the state of Pennsylvania to set up a new high-risk insurance pool program that would cover any abortion legal in the state.,false,true
VL009473,"""The so-called doc fix in the fiscal cliff deal will cut payments """"for treating illnesses disproportionately impacting minorities, including end stage renal disease and diabetes.""","""The so-called doc fix in the fiscal cliff deal will not cut payments """"for treating illnesses disproportionately impacting minorities, including end stage renal disease and diabetes."".",true,false
VL009475,"IU doctors say screening could save lives, money","IU doctors say screening could not save lives, money.",false,true
VL009479,"""Sarah Palin Says Attorney General Eric Holder recently revealed """"this idea to have government have gun owners wear special bracelets that would identify you as a gun owner.""","""Sarah Palin Says Attorney General Eric Holder recently revealed """"this idea to have not government have gun owners wear special bracelets that would identify you as a gun owner."".",false,true
VL009482,There are several versions of         this eRumor but all of them say that commonly sold cocoa mulch contains         theobromine which can be lethal to cats and dogs.  One version         tells the story of a pet owner who lost a dog because of cocoa mulch.,There are not several versions of this eRumor but all of them say that commonly sold cocoa mulch contains theobromine which can be lethal to cats and dogs. One version tells the story of a pet owner who lost a dog because of cocoa mulch.,true,false
VL009483,Department of Health and Human Services appointee Charmaine Yoest repeated the false claim abortion causes breast cancer.,Department of Health and Human Services appointee Charmaine Yoest repeated the false claim abortion does not cause breast cancer.,true,false
VL009489,"This is a forwarded plea for a 5 year old boy named Noah Biorkman who is said to be in the last stages of cancer. The email says his family is requesting that people all around the country mail Christmas cards to their son early, as he is not expected to live to see Christmas, 2009.","This is not a forwarded plea for a 5 year old boy named Noah Biorkman who is said to be in the last stages of cancer. The email says his family is requesting that people all around the country mail Christmas cards to their son early, as he is not expected to live to see Christmas, 2009.",true,false
VL009490,GLIOBLASTOMA: ZIKA VIRUS COULD DESTROY BRAIN CANCER THAT KILLED JOHN MCCAIN,GLIOBLASTOMA: ZIKA VIRUS COULD not DESTROY BRAIN CANCER THAT KILLED JOHN MCCAIN.,true,false
VL009492,"Born Basic Anti-Bac hand sanitizer was recalled in the U.S. after being found to contain methanol, a poisonous chemical.","Born Basic Anti-Bac hand sanitizer was not recalled in the U.S. after being found to contain methanol, a poisonous chemical.",true,false
VL009497,"""Dan Webster """"would force victims of rape and incest to bear their attacker's child.""","""Dan Webster """"would not force victims of rape and incest to bear their attacker's child."".",true,false
VL009508,"In 40 years, 23,000 chemicals came on the market and only four were regulated.","In 40 years, 23,000 chemicals came on the market and only four were not regulated.",false,true
VL009510,The Koch brothers are one of the biggest polluters in the country.,The Koch brothers are not one of the biggest polluters in the country.,true,false
VL009512,“The (corona)virus just isn’t nearly as deadly as we thought it was.”,“The (corona)virus just isn’t nearly as deadly as we thought it was not.”.,false,true
VL009517,In three years we could find close to 50 million gallons per day through a toilet replacement program.,In three years we could not find close to 50 million gallons per day through a toilet replacement program.,true,false
VL009518,Study: Other Drugs May Limit Plavix’s Effectiveness,Study: Other Drugs May not Limit Plavix’s Effectiveness.,true,false
VL009521,Criminals in the U.S. are using burundanga-soaked business cards to incapacitate their victims.,Criminals in the U.S. are not using burundanga-soaked business cards to incapacitate their victims.,false,true
VL009523,"""California’s proposed tobacco tax """"diverts 82 percent of the new taxes to line the pockets of wealthy special interests like insurance companies who don't have to help even one more patient.""","""California’s proposed tobacco tax """"diverts 82 percent of the new taxes to line the pockets of wealthy special interests like insurance companies who don't have not to help even one more patient."".",false,true
VL009524,"After actor Christopher Reeve was paralyzed in an accident, his friend and colleague Robin Williams lifted his spirits by pretending to be a proctologist.","After actor Christopher Reeve was not paralyzed in an accident, his friend and colleague Robin Williams lifted his spirits by pretending to be a proctologist.",true,false
VL009527,"South Korea has tested 200,000 people for coronavirus, prioritizing the most vulnerable people. The CDC only tested 77 people this week. Yet, the Utah Jazz was able to test all 58 players in a matter of hours.","South Korea has not tested 200,000 people for coronavirus, prioritizing the most vulnerable people. The CDC only tested 77 people this week. Yet, the Utah Jazz was able to test all 58 players in a matter of hours.",true,false
VL009528,In 1988 author Roald Dahl penned an open letter urging parents to have their children vaccinated against measles.,In 1988 author Roald Dahl penned an open letter urging parents to have not their children vaccinated against measles.,true,false
VL009532,Medicare drug plan finder can steer seniors to higher costs.,Medicare drug plan finder can not steer seniors to higher costs.,true,false
VL009533,"""Health insurance and medical costs """"are going down because of Obamacare.""","""Health insurance and medical costs """"are not going down because of Obamacare."".",false,true
VL009534,Abortion pill might help battle breast cancer,Abortion pill might not help battle breast cancer.,true,false
VL009536,The cause of country music star Joe Diffie's death was lung cancer.,The cause of country music star Joe Diffie's death was not lung cancer.,false,true
VL009537,State: Care center where 11 kids died can resume admissions.,State: Care center where 11 kids died can not resume admissions.,true,false
