id,claim,negated_claim,label_original,label_negated
VL006274,....There are people trying to make legal age of consent 4 years old. Let that sink in. #SaveOurChildren,....There are not people trying to make legal age of consent 4 years old. Let that sink in. #SaveOurChildren.,false,true
VL006276,Experiment proves water that has been boiled in a microwave oven is harmful to plants.,Experiment proves water that has not been boiled in a microwave oven is harmful to plants.,false,true
VL006282,"""Birth control pioneer Margaret Sanger """"believed that people like me should be eliminated.""","""Birth control pioneer Margaret Sanger """"believed that people like me should not be eliminated."".",false,true
VL006285,Facebook is donating $1 for every share of a photo to fund treatment of a puppy's tumor.,Facebook is not donating $1 for every share of a photo to fund treatment of a puppy's tumor.,false,true
VL006290,Preemies may face higher death rates as adults.,Preemies may not face higher death rates as adults.,true,false
VL006292,Malia Obama was arrested while attempting to purchase marijuana in Chicago.,Malia Obama was not arrested while attempting to purchase marijuana in Chicago.,false,true
VL006293,Swedish-born producer DJ Avicii died under suspicious circumstances while he was trying to use music videos to expose a pedophile ring,Swedish-born producer DJ Avicii died under suspicious circumstances while he was not trying to use music videos to expose a pedophile ring.,false,true
VL006297,President Donald Trump has repeated the claim that Hillary Clinton sold 20 percent of America’s Uranium to Russia while secretary of state on the campaign trail and while in office.,President Donald Trump has not repeated the claim that Hillary Clinton sold 20 percent of America’s Uranium to Russia while secretary of state on the campaign trail and while in office.,false,true
VL006300,"""Back door gun control is in full effect in the United States"""" due to """"Obama’s Environmental Protection Agency.""","""Back door gun control is not in full effect in the United States"""" due to """"Obama’s Environmental Protection Agency."".",false,true
VL006301,"In June 2020, Weis Markets banned its employees from wearing any representation of the American flag because it was considered controversial amidst the political climate. They also banned the flag from being displayed on merchandise.","In June 2020, Weis Markets banned its employees from wearing any representation of the American flag because it was not considered controversial amidst the political climate. They also banned the flag from being displayed on merchandise.",false,true
VL006303,"""Seven """"key witnesses"""" to the 1 October 2017 mass shooting in Las Vegas have suspiciously died in a cover-up.""","""Seven """"key witnesses"""" to the 1 October 2017 mass shooting in Las Vegas have not suspiciously died in a cover-up."".",false,true
VL006308,"Peanuts, peanut butter may hold key to preventing obesity","Peanuts, peanut butter may not hold key to preventing obesity.",false,true
VL006319,"""A """"massive"""" federal computer network will make your medical records available to """"millions of people"""" with a """"complete lack of privacy and confidentiality,"""" while doctors and hospitals who don't take part face """"stiff penalties.""","""A """"massive"""" federal computer network will not make your medical records available to """"millions of people"""" with a """"complete lack of privacy and confidentiality,"""" while doctors and hospitals who don't take part face """"stiff penalties."".",false,true
VL006330,"""Most states that have legalized marijuana use have subsequently banned marijuana users from owning guns as a """"back-door"""" gun control measure.""","""Most states that have not legalized marijuana use have subsequently banned marijuana users from owning guns as a """"back-door"""" gun control measure."".",false,true
VL006334,"Moscow, in U-turn, to assume all pneumonia patients may have coronavirus.","Moscow, in U-turn, to assume all pneumonia patients may not have coronavirus.",true,false
VL006338,"""He has """"ushered in $3 billion in new investment.""","""He has not """"ushered in $3 billion in new investment."".",false,true
VL006341,Maternal figures were typically absent in Walt Disney's animated films because he felt responsible for his own mother's death.,Maternal figures were not typically absent in Walt Disney's animated films because he felt responsible for his own mother's death.,false,true
VL006345,This is Brian. Brian is an Antifa street rioter. Brian has an allergy. Brian is allergic to hitting a woman in front of a REAL MAN. Don't be like Brian.,This is Brian. Brian is not an Antifa street rioter. Brian has an allergy. Brian is allergic to hitting a woman in front of a REAL MAN. Don't be like Brian.,false,true
VL006347,"This is a photograph of a   letter from C. Dennis Packee of Reiman’s Harley-Davidson in Kewanee, Ill.,   to Christopher and Jamie Walters. The letter explains that Reiman’s will   store the Walters’ motorcycles at no charge. It is their way of saying   thank you to military members on deployment.","This is not a photograph of a letter from C. Dennis Packee of Reiman’s Harley-Davidson in Kewanee, Ill., to Christopher and Jamie Walters. The letter explains that Reiman’s will store the Walters’ motorcycles at no charge. It is their way of saying thank you to military members on deployment.",true,false
VL006349,Peanut butter can be used to diagnose Alzheimer’s Disease.,Peanut butter can not be used to diagnose Alzheimer’s Disease.,false,true
VL006357,Sweden has the highest rate of rape among European countries.,Sweden has not the highest rate of rape among European countries.,false,true
VL006358,Statistics show 2 to 3 Texas women per week have major complications and 10 women per week seek help at an ER after an abortion.,Statistics show 2 to 3 Texas women per week have not major complications and 10 women per week seek help at an ER after an abortion.,false,true
VL006362,"""Chelsea Clinton tweeted that """"genital mutilation"""" is a culturally loaded, racist term, and that the practice of """"genital cutting"""" has many health benefits.""","""Chelsea Clinton tweeted that """"genital mutilation"""" is not a culturally loaded, racist term, and that the practice of """"genital cutting"""" has many health benefits."".",false,true
VL006364,"Eric Esshaki Says Haley Stevens’ plan for “socialized medicine” would “eliminate 100,000 doctors and nurses.”","Eric Esshaki Says Haley Stevens’ plan for “socialized medicine” would not “eliminate 100,000 doctors and nurses.”.",false,true
VL006367,Wisconsin has “no tracing program going on that we can speak of.,Wisconsin has not “no tracing program going on that we can speak of.,false,true
VL006386,"This       is a prayer request for 2 year old Michael Novenche from New York.  The       email says he’s got a brain tumor, underwent surgery, but only a portion       of the tumor was removed and he is now going through       chemotherapy.","This is not a prayer request for 2 year old Michael Novenche from New York. The email says he’s got a brain tumor, underwent surgery, but only a portion of the tumor was removed and he is now going through chemotherapy.",true,false
VL006391,Overdosing is now the number one accidental killer in our Commonwealth.,Overdosing is not now the number one accidental killer in our Commonwealth.,true,false
VL006393,J&J joins development of blood test that can spot 1 cancer cell in a billion healthy ones,J&J joins development of blood test that can not spot 1 cancer cell in a billion healthy ones.,true,false
VL006394,Entering your PIN in reverse at any ATM will automatically summon the police.,Entering your PIN in reverse at any ATM will not automatically summon the police.,false,true
VL006397,Less than 5 percent of registered users in states allowing medical marijuana have cancer or AIDS.,Less than 5 percent of registered users in states allowing medical marijuana have not cancer or AIDS.,true,false
VL006398,Pictures and reports of “empty hospitals” prove COVID-19 spread is “fake crisis for real government planned agendas.”,Pictures and reports of “empty hospitals” prove COVID-19 spread is not “fake crisis for real government planned agendas.”.,false,true
VL006401,"1-year-old daughter, wife of Congo’s Goma victim have Ebola.","1-year-old daughter, wife of Congo’s Goma victim have not Ebola.",true,false
VL006403,"The U.S. government was sued and found culpable for the murder of Martin Luther King, Jr., but the news media refused to report it.","The U.S. government was not sued and found culpable for the murder of Martin Luther King, Jr., but the news media refused to report it.",false,true
VL006405,Senator Elizabeth Warren has been on Risperdal since first being prescribed the drug in 2011.,Senator Elizabeth Warren has not been on Risperdal since first being prescribed the drug in 2011.,false,true
VL006407,Warnings that someone is injecting poising into water bottles circulated on social media in March 2018.,Warnings that someone is not injecting poising into water bottles circulated on social media in March 2018.,false,true
VL006414,"A hotel cleaner in Las Vegas stole a millionaire's used condom from his room, became pregnant, and was awarded millions of dollars in child support for the scheme.","A hotel cleaner in Las Vegas stole a millionaire's used condom from his room, became pregnant, and was not awarded millions of dollars in child support for the scheme.",false,true
VL006420,Marshalltown hospital will close obstetrics unit.,Marshalltown hospital will not close obstetrics unit.,true,false
VL006421,58% of coronavirus deaths in Scotland are from care facilities.,58% of coronavirus deaths in Scotland are not from care facilities.,false,true
VL006422,Casual pot use causes brain abnormalities in the young: study.,Casual pot use does not cause brain abnormalities in the young: study.,true,false
VL006431,"Cigarettes, coffee may lower Parkinson’s risk","Cigarettes, coffee may not lower Parkinson’s risk.",false,true
VL006434,The Department of Health and Human Services has scheduled web site maintenance for Healthcare.gov on most Sundays during Obamacare open enrollment.,The Department of Health and Human Services has not scheduled web site maintenance for Healthcare.gov on most Sundays during Obamacare open enrollment.,true,false
VL006438,"""Planned Parenthood is """"nothing more than a referral service. … They don’t do anything except profit from killing babies and then selling body parts of those aborted babies.""","""Planned Parenthood is not """"nothing more than a referral service. … They don’t do anything except profit from killing babies and then selling body parts of those aborted babies."".",false,true
VL006440,"""Lizbeth Benacquisto's supporters """"would make (abortion) illegal in all cases, including rape, incest, even to save a woman's life.""","""Lizbeth Benacquisto's supporters """"would not make (abortion) illegal in all cases, including rape, incest, even to save a woman's life."".",true,false
VL006449,"ANTIDEPRESSANTS DO WORK, AND MANY MORE PEOPLE SHOULD TAKE THEM: MAJOR INTERNATIONAL STUDY","ANTIDEPRESSANTS DO not WORK, AND MANY MORE PEOPLE SHOULD TAKE THEM: MAJOR INTERNATIONAL STUDY.",false,true
VL006450,"""Ken Cuccinelli Says Terry McAuliffe is """"the person who invented the scheme to rent out the Lincoln Bedroom.""","""Ken Cuccinelli Says Terry McAuliffe is not """"the person who invented the scheme to rent out the Lincoln Bedroom."".",false,true
VL006454,"Tom DeLay Says Travis County, home to Austin, is the most liberal county in the United States.","Tom DeLay Says Travis County, home to Austin, is not the most liberal county in the United States.",false,true
VL006456,"""During a 1955 speech at West Point, General Douglas MacArthur told assembled cadets: """"The next war will be an interplanetary war. The nations of the earth must someday make a common front against attack by people from other planets.""","""During a 1955 speech at West Point, General Douglas MacArthur told assembled cadets: """"The next war will not be an interplanetary war. The nations of the earth must someday make a common front against attack by people from other planets."".",false,true
VL006458,"Mars had the right stuff for life, scientists find.","Mars had not the right stuff for life, scientists find.",true,false
VL006459,President Obama is giving Mexico $75 million to build a wall on their southern border.,President Obama is not giving Mexico $75 million to build a wall on their southern border.,false,true
VL006461,Congo minister's resignation over Ebola snub could unblock new vaccine.,Congo minister's resignation over Ebola snub could not unblock new vaccine.,true,false
VL006463,An image purportedly showing a petri dish of bacteria grown after swabbing a mask worn by a child for twenty minutes proves that face masks are a health risk.,An image purportedly showing a petri dish of bacteria grown after swabbing a mask worn by a child for twenty minutes proves that face masks are not a health risk.,false,true
VL006465,"On Sept. 18, 2020, Twitter user @JohnCammo predicted that U.S. President Donald Trump would announce in October that he had tested positive for COVID-19.","On Sept. 18, 2020, Twitter user @JohnCammo predicted that U.S. President Donald Trump would not announce in October that he had tested positive for COVID-19.",true,false
VL006466,"Cardiac stem cells from young hearts could rejuvenate old hearts, new study shows","Cardiac stem cells from young hearts could not rejuvenate old hearts, new study shows.",false,true
VL006467,Study: Asian carp could find plenty of food in Lake Michigan.,Study: Asian carp could not find plenty of food in Lake Michigan.,true,false
VL006468,Trans teen’s war with his body started when he was just 10.,Trans teen’s war with his body started when he was not just 10.,true,false
VL006469,"""Jill Stein Says climate scientist James Hansen says """"we have until perhaps 50 years from now,"""" or maybe a little longer """"and at that point, we are looking at 10, 20, 30 feet of sea-level rise.""","""Jill Stein Says climate scientist James Hansen says """"we have not until perhaps 50 years from now,"""" or maybe a little longer """"and at that point, we are looking at 10, 20, 30 feet of sea-level rise."".",false,true
VL006472,"""Two altar boys were arrested for """"putting weed in the censer-burner.""","""Two altar boys were not arrested for """"putting weed in the censer-burner."".",false,true
VL006473,“Wisconsin is the only state where all Republicans voted against protecting its citizens.”,“Wisconsin is not the only state where all Republicans voted against protecting its citizens.”.,true,false
VL006475,‘WEEKEND WARRIOR’ WORKOUTS ARE BENEFICIAL AS JUST 20 MINUTES OF EXERCISE A DAY,‘WEEKEND WARRIOR’ WORKOUTS ARE not BENEFICIAL AS JUST 20 MINUTES OF EXERCISE A DAY.,true,false
VL006478,"""John Whitmire Says the Texas Board of Nursing has a backlog of """"3,000 complaints against nurses, many of them sexual assaults, malfeasance.""","""John Whitmire Says the Texas Board of Nursing has not a backlog of """"3,000 complaints against nurses, many of them sexual assaults, malfeasance."".",true,false
VL006479,"""There have been 74 """"school shootings in America since Sandy Hook.""","""There have not been 74 """"school shootings in America since Sandy Hook."".",false,true
VL006487,Nursing home where 12 died after storm has license revoked.,Nursing home where 12 died after storm has not license revoked.,true,false
VL006488,A photograph shows a man who was diagnosed with eye cancer due to using his cell phone at night.,A photograph shows a man who was not diagnosed with eye cancer due to using his cell phone at night.,false,true
VL006490,Rapists are using small children who appear to be lost to lure victims to them.,Rapists are not using small children who appear to be lost to lure victims to them.,false,true
VL006491,Barack Obama “is the first ex-president to ever speak against his successor.”,Barack Obama “is not the first ex-president to ever speak against his successor.”.,false,true
VL006494,Three Heart Tests Every Woman Should Know About,Three Heart Tests Every Woman Should not Know About.,false,true
VL006495,Covid-19 patients have been misdiagnosed as having pneumonia when they actually have a blood clotting condition called disseminated intravascular coagulation.,Covid-19 patients have not been misdiagnosed as having pneumonia when they actually have a blood clotting condition called disseminated intravascular coagulation.,false,true
VL006506,0070031450 A1 is a US patent for BSE (mad cow disease).,0070031450 A1 is not a US patent for BSE (mad cow disease).,false,true
VL006508,Six thousand people have sought addiction treatment through expanded Medicaid.,Six thousand people have not sought addiction treatment through expanded Medicaid.,false,true
VL006509,Noninvasive stimulation device can help prevent migraine attacks,Noninvasive stimulation device can not help prevent migraine attacks.,false,true
VL006510,Robotic prostate surgery may mean big trade-off,Robotic prostate surgery may not mean big trade-off.,true,false
VL006511,The Democrats filibustered the legislation that would’ve resulted in this shooter being in federal prison instead of murdering those innocents in that Texas church.,The Democrats filibustered the legislation that would not’ve resulted in this shooter being in federal prison instead of murdering those innocents in that Texas church.,false,true
VL006513,An aspirin a day – for years – may keep colon cancer away,An aspirin a day – for years – may not keep colon cancer away.,true,false
VL006516,"""Sen. Joe Biden told an audience which included hundreds of African Americans that Republican economic policies would """"put y'all back in chains.""","""Sen. Joe Biden told an audience which included hundreds of African Americans that Republican economic policies would not """"put y'all back in chains."".",true,false
VL006517,"Coons, US Senator from Delaware, will face primary challenge.","Coons, US Senator from Delaware, will not face primary challenge.",true,false
VL006519,"""South Carolina state Senator Thomas Corbin told a colleague at a dinner function that women are a """"lesser cut of meat.""","""South Carolina state Senator Thomas Corbin told a colleague at a dinner function that women are not a """"lesser cut of meat."".",true,false
VL006520,This is a forwarded email that warns not to eat tilapia because it comes from China.,This is not a forwarded email that warns not to eat tilapia because it comes from China.,false,true
VL006521,A priest with HIV who raped children was exonerated by the Catholic Church and then crucified.,A priest with HIV who raped children was not exonerated by the Catholic Church and then crucified.,false,true
VL006523,"Diesel vehicle refits costly and could affect performance, Volkswagen says.","Diesel vehicle refits costly and could not affect performance, Volkswagen says.",true,false
VL006531,"""Donald Trump said veterans suffering from PTSD are """"weak,"""" """"unfit,"""" and """"can't handle"""" military service.""","""Donald Trump said veterans suffering from PTSD are not """"weak,"""" """"unfit,"""" and """"can't handle"""" military service."".",false,true
VL006532,Indonesia transport minister confirmed to have coronavirus as cases climb.,Indonesia transport minister confirmed to have not coronavirus as cases climb.,true,false
VL006534,"Linda Collins-Smith, a former Arkansas politician who was shot to death in June 2019, was about to testify against Hillary Clinton.","Linda Collins-Smith, a former Arkansas politician who was not shot to death in June 2019, was about to testify against Hillary Clinton.",false,true
VL006536,Products from Pepsi and other major food producers are 'manufactured using the tissue of aborted human babies.',Products from Pepsi and other major food producers are not 'manufactured using the tissue of aborted human babies.'.,false,true
VL006540,"Science should find aliens, halt cancer: survey.","Science should not find aliens, halt cancer: survey.",true,false
VL006541,The media “pulled down an entire shelf of goods so that they can present the news of people buying stuff in a hysteria over the coronavirus.,The media “pulled down an entire shelf of goods so that they can not present the news of people buying stuff in a hysteria over the coronavirus.,false,true
VL006542,Sexual health report says $25 per woman per year would reduce deaths.,Sexual health report says $25 per woman per year would not reduce deaths.,true,false
VL006544,"""Senator Dianne Feinstein said that """"All vets are mentally ill and the government should prevent them from owning firearms.""","""Senator Dianne Feinstein said that """"All vets are not mentally ill and the government should prevent them from owning firearms."".",false,true
VL006545,"""Herman Cain Says """"in Canada, the number of CT scan machines per 1,000 people is like one-tenth of what we have here in this country. That's why people have to wait.""","""Herman Cain Says """"in Canada, the number of CT scan machines per 1,000 people is not like one-tenth of what we have here in this country. That's why people have to wait."".",false,true
VL006552,Jay Goyal Says there are more federal dollars in Gov. John Kasich's budget plan than in the previous state budget.,Jay Goyal Says there are not more federal dollars in Gov. John Kasich's budget plan than in the previous state budget.,false,true
VL006553,"""A dangerous new drug known as """"gray death"""" can kill through the air and skin contact.""","""A dangerous new drug known as """"gray death"""" can not kill through the air and skin contact."".",true,false
VL006556,"Georgia has had 12 school shootings in the two years since the mass killing at Sandy Hook Elementary School, more than any other state.","Georgia has not had 12 school shootings in the two years since the mass killing at Sandy Hook Elementary School, more than any other state.",false,true
VL006557,"""Sotomayor """"ruled against the white firefighter — Ricci and other white firefighters — just on the basis that she thought women and minorities should be given a preference because of their skin color and because of the history of discrimination in the past. The law was totally disregarded.""","""Sotomayor """"ruled against the white firefighter — Ricci and other white firefighters — just on the basis that she thought women and minorities should not be given a preference because of their skin color and because of the history of discrimination in the past. The law was totally disregarded."".",false,true
VL006558,"Posthumous sperm donation should be allowed, say UK experts.","Posthumous sperm donation should not be allowed, say UK experts.",true,false
VL006562,Brain scans predict which dyslexics will read.,Brain scans predict which dyslexics will not read.,true,false
VL006565,Women who eat lots of fiber have less breast cancer,Women who eat lots of fiber have not less breast cancer.,true,false
VL006566,Weight-loss drugs may harm developing brain: study.,Weight-loss drugs may not harm developing brain: study.,true,false
VL006567,"""Marijuana is a Schedule I drug, """"which you understand means that you can’t do any research about it.""","""Marijuana is not a Schedule I drug, """"which you understand means that you can’t do any research about it."".",false,true
VL006570,"""Austin is """"effectively"""" imposing """"a ban on barbecue restaurants.""","""Austin is not """"effectively"""" imposing """"a ban on barbecue restaurants."".",false,true
VL006571,"""When the Milwaukee County mental health facility is full, """"cops sit out there in their squad cars with a mentally ill patient""""  and sometimes """"spend an entire shift out there doing that.""","""When the Milwaukee County mental health facility is not full, """"cops sit out there in their squad cars with a mentally ill patient"""" and sometimes """"spend an entire shift out there doing that."".",false,true
VL006572,A New York man has allegedly infected 240 people with the HIV virus by sleeping with men and women.,A New York man has not allegedly infected 240 people with the HIV virus by sleeping with men and women.,false,true
VL006574,A scientific study shows the death of Alfie Evans was caused by aluminum additives in vaccines.,A scientific study shows the death of Alfie Evans was not caused by aluminum additives in vaccines.,false,true
VL006576,The Trump administration has had “zero unfulfilled equipment and supply requests from state governors.”,The Trump administration has not had “zero unfulfilled equipment and supply requests from state governors.”.,false,true
VL006577,Our (COVID-19) numbers are better than almost all countries.,Our (COVID-19) numbers are not better than almost all countries.,false,true
VL006579,Ovarian Tissue Transplant Can Help Some Women Have Kids After Cancer Treatment Researchers in Denmark report a success rate of about 30 percent,Ovarian Tissue Transplant Can not Help Some Women Have Kids After Cancer Treatment Researchers in Denmark report a success rate of about 30 percent.,true,false
VL006580,The facts show that approximately 40 persons on death row have had all of their appellate review completed and await only the governor's signature on a death warrant to end the case.,The facts show that approximately 40 persons on death row have not had all of their appellate review completed and await only the governor's signature on a death warrant to end the case.,true,false
